Review,Liked
I had the opportunity today to sample your amazing pizzas!,1
We waited for thirty minutes to be seated (although there were 8 vacant tables and we were the only folks waiting).,0
The yellowtail carpaccio was melt in your mouth fresh.,0
I won't try going back there even if it's empty.,0
No,0
Just spicy enough.. Perfect actually.,1
Last night was my second time dining here and I was so happy I decided to go back!,1
"not even a ""hello, we will be right with you."",0",1
The desserts were a bit strange.,0
My boyfriend and I came here for the first time on a recent trip to Vegas and could not have been more pleased with the quality of food and service.,1
I really do recommend this place,1
Nice ambiance.,0
I would recommend saving room for this!,1
I guess maybe we went on an off night but it was disgraceful.,0
However,0
I know this is not like the other restaurants at all,1
AVOID THIS ESTABLISHMENT!,1
I think this restaurant suffers from not trying hard enough.,0
All of the tapas dishes were delicious!,1
I *heart* this place.,0
My salad had a bland vinegrette on the baby greens and hearts of Palm.,1
After two I felt disgusting.,0
A good time!,0
I believe that this place is a great stop for those with a huge belly and hankering for sushi.,1
Generous portions and great taste.,1
I will never go back to this place and will never ever recommended this place to anyone!,1
"The servers went back and forth several times, not even so much as an ""Are you being helped?"",0",0
Food was delicious!,1
AN HOUR... seriously?,0
I consider this theft.,1
Eew... This location needs a complete overhaul.,0
We recently witnessed her poor quality of management towards other guests as well.,1
Waited and waited and waited.,1
He also came back to check on us regularly,1
Our server was super nice and checked on us many times.,0
The pizza tasted old,0
I swung in to give them a try but was deeply disappointed.,0
Service was good and the company was better!,0
The staff are also very friendly and efficient.,1
As for the service: I'm a fan,1
Boy was that sucker dry!!.,0
Over rated.,1
If you look for authentic Thai food,0
Their steaks are 100% recommended!,0
After I pulled up my car I waited for another 15 minutes before being acknowledged.,0
Great food and great service in a clean and friendly setting.,0
All in all,1
I hate those things as much as cheap quality black olives.,1
My breakfast was perpared great,0
The kids play area is NASTY!,0
Great place fo take out or eat in.,0
The waitress was friendly and happy to accomodate for vegan/veggie options.,0
OMG I felt like I had never eaten Thai food until this dish.,0
"It was extremely ""crumby"" and pretty tasteless.,0",0
It was a pale color instead of nice and char and has NO flavor.,0
The croutons also taste homemade which is an extra plus.,0
I got home to see the driest damn wings ever!,1
It'll be a regular stop on my trips to Phoenix!,0
I really enjoyed Crema CafǸ before they expanded. I even told friends they had the BEST breakfast.,1
Not good for the money.,0
I miss it and wish they had one in Philadelphia!,0
We got sitting fairly fast,1
They also have the best cheese crisp in town.,1
Good value,0
Couldn't ask for a more satisfying meal.,0
The food is good.,0
It was awesome.,0
I just wanted to leave.,1
We made the drive all the way from North Scottsdale... and I was not one bit disappointed!,0
I will not be eating there again.,1
!....THE OWNERS REALLY REALLY need to quit being soooooo cheap let them wrap my freaking sandwich in two papers not one!,1
I checked out this place a couple years ago and was not impressed.,0
The chicken I got was definitely reheated and was only ok,1
Sorry,0
An absolute must visit!,0
The cow tongue and cheek tacos are amazing.,1
My friend did not like his Bloody Mary.,1
Despite how hard I rate businesses,1
They really want to make your experience a good one.,1
I will not return.,0
I had the chicken Pho and it tasted very bland.,0
Very disappointing!!!,1
The grilled chicken was so tender and yellow from the saffron seasoning.,0
a drive thru means you do not want to wait around for half an hour for your food,0
Pretty awesome place.,0
Ambience is perfect.,1
Best of luck to the rude and non-customer service focused new management.,0
Any grandmother can make a roasted chicken better than this one.,1
I asked multiple times for the wine list and after some time of being ignored I went to the hostess and got one myself.,0
The staff is always super friendly and helpful,0
Four stars for the food & the guy in the blue shirt for his great vibe & still letting us in to eat !,0
The roast beef sandwich tasted really good!,1
Same evening,1
High-quality chicken on the chicken Caesar salad.,1
Ordered burger rare came in we'll done.,0
We were promptly greeted and seated.,0
Tried to go here for lunch and it was a madhouse.,1
I was proven dead wrong by this sushi bar,1
After waiting an hour and being seated,1
This is a good joint.,0
The Macarons here are insanely good.,0
I'm not eating here!,1
Our waiter was very attentive,0
Maybe if they weren't cold they would have been somewhat edible.,0
This place has a lot of promise but fails to deliver.,0
Very bad Experience!,1
What a mistake.,0
Food was average at best.,1
Great food.,0
We won't be going back anytime soon!,0
Very Very Disappointed ordered the $35 Big Bay Plater.,0
Great place to relax and have an awesome burger and beer.,0
It is PERFECT for a sit-down family meal or get together with a few friends.,0
Not much flavor to them,0
The patio seating was very comfortable.,0
The fried rice was dry as well.,0
Hands down my favorite Italian restaurant!,0
"That just SCREAMS ""LEGIT"" in my book...somethat's also pretty rare here in Vegas.,1",0
It was just not a fun experience.,0
The atmosphere was great with a lovely duo of violinists playing songs we requested.,0
I personally love the hummus,0
Very convenient,0
The owners are super friendly and the staff is courteous.,0
Both great!,0
Eclectic selection.,0
The sweet potato tots were good but the onion rings were perfection or as close as I have had.,0
The staff was very attentive.,0
And the chef was generous with his time (even came around twice so we can take pictures with him).,0
The owner used to work at Nobu,0
Google mediocre and I imagine Smashburger will pop up.,0
dont go here.,0
I promise they won't disappoint.,0
As a sushi lover avoid this place by all means.,0
What a great double cheeseburger!,0
Awesome service and food.,0
A fantastic neighborhood gem !!!,0
I can't wait to go back.,0
The plantains were the worst I've ever tasted.,0
It's a great place and I highly recommend it.,0
Service was slow and not attentive.,0
I gave it 5 stars then,0
Your staff spends more time talking to themselves than me.,0
Dessert: Panna Cotta was amazing.,0
Very good food,0
Damn good steak.,0
Total brunch fail.,0
Prices are very reasonable,0
The decor is nice,0
The steak was amazing...rge fillet relleno was the best seafood plate i have ever had!,0
Good food ,0
It was absolutely amazing.,0
I probably won't be back,0
will definitely be back!,0
The sergeant pepper beef sandwich with auju sauce is an excellent sandwich as well.,0
Hawaiian Breeze,0
Went for lunch - service was slow.,0
We had so much to say about the place before we walked in that he expected it to be amazing,0
I was mortified.,0
Needless to say,0
Anyways,0
The chips that came out were dripping with grease,0
I wasn't really impressed with Strip Steak.,0
Have been going since 2007 and every meal has been awesome!!,0
Our server was very nice and attentive as were the other serving staff.,0
The cashier was friendly and even brought the food out to me.,0
I work in the hospitality industry in Paradise Valley and have refrained from recommending Cibo any longer.,0
